{
  "schema": "finding/1",
  "id": "f_9c1e",
  "source": {
    "lens": "pr-review",
    "kind": "role",
    "actor": "combsmith-sf-pr-review[bot]"
  },
  "surface": {
    "type": "thread",
    "key": "PRRT_kw7"
  },
  "location": {
    "path": "kernel/decide.py",
    "start_line": 88,
    "end_line": 94
  },
  "category": "functional",
  "severity": "major",
  "criterion": "PR-3",
  "adopted_from": {
    "lens": "coderabbit",
    "surface": {
      "type": "thread",
      "key": "PRRT_kw1"
    }
  },
  "content_id": "sha256:5d0c"
}
